{
  "$schema": "https://json-schema.org/draft/2020-12/schema",
  "$id": "https://schemas.juniorbay.com/stripe-link/ShippingConfig.schema.json",
  "title": "ShippingConfig",
  "type": "object",
  "additionalProperties": false,
  "required": [
    "schema_version",
    "document_type",
    "tenant_id",
    "provider"
  ],
  "properties": {
    "schema_version": {
      "type": "string",
      "const": "2026-05-29"
    },
    "document_type": {
      "type": "string",
      "const": "shipping_config"
    },
    "tenant_id": {
      "type": "string",
      "minLength": 1
    },
    "enabled": {
      "type": "boolean",
      "default": false,
      "description": "Whether this tenant offers shipping. Auto-ticked by a successful connection test -- a tenant who has connected a carrier wants to ship, and a second checkbox saying so is a step the software can infer. Until 2026-10-11 nothing read this field at all."
    },
    "enabled_opt_out": {
      "type": "boolean",
      "description": "The tenant DELIBERATELY turned shipping off, so a later connection test must not turn it back on. Written only on a transition from on to off, and cleared by ticking `enabled` again. Separate from `enabled: false` because that was the default of a checkbox that gated nothing, so every pre-existing config carries it by accident -- reading it as a decision would have switched shipping off for every tenant on deploy."
    },
    "test_mode": {
      "type": "boolean",
      "default": true
    },
    "auto_fulfill_after_label_purchase": {
      "type": "boolean",
      "default": false
    },
    "provider": {
      "type": "object",
      "additionalProperties": false,
      "required": [
        "name"
      ],
      "properties": {
        "name": {
          "type": "string",
          "enum": [
            "shippo",
            "easypost",
            "shipstation",
            "easyship",
            "mock"
          ]
        },
        "api_key_ref": {
          "type": "string",
          "description": "Reference to the encrypted provider API key; never store raw API keys in this document."
        },
        "keys": {
          "type": "object",
          "description": "ONE CARRIER KEY PER STRIPE MODE. The config used to hold a single `api_key_ref`, with no mode axis anywhere in the shipping path -- so a tenant in TEST mode bought real labels with their live key, and saving a test key destroyed the live one. The provider name, addresses, boxes and label options stay shared: those are the same facts in both modes. `api_key_ref` above is the pre-split field, still read when its own prefix says which mode it belongs to. See domain/shipping_keys.py.",
          "properties": {
            "test": {
              "type": "object",
              "properties": {
                "api_key_ref": {
                  "type": "string",
                  "description": "KMS-wrapped carrier key for this mode. Never returned to the browser."
                },
                "connection_status": {
                  "type": "string",
                  "enum": [
                    "not_configured",
                    "untested",
                    "connected",
                    "failed"
                  ]
                },
                "last_tested_at": {
                  "type": "integer"
                },
                "has_key": {
                  "type": "boolean",
                  "description": "Read-only, added on redaction so the dashboard can say which modes are configured."
                }
              },
              "additionalProperties": false
            },
            "live": {
              "type": "object",
              "properties": {
                "api_key_ref": {
                  "type": "string",
                  "description": "KMS-wrapped carrier key for this mode. Never returned to the browser."
                },
                "connection_status": {
                  "type": "string",
                  "enum": [
                    "not_configured",
                    "untested",
                    "connected",
                    "failed"
                  ]
                },
                "last_tested_at": {
                  "type": "integer"
                },
                "has_key": {
                  "type": "boolean",
                  "description": "Read-only, added on redaction so the dashboard can say which modes are configured."
                }
              },
              "additionalProperties": false
            }
          },
          "additionalProperties": false
        },
        "base_url": {
          "type": "string"
        },
        "connection_status": {
          "type": "string",
          "enum": [
            "not_configured",
            "untested",
            "connected",
            "failed"
          ],
          "default": "not_configured"
        },
        "last_tested_at": {
          "type": "integer",
          "minimum": 0
        }
      }
    },
    "ship_from_address": {
      "$ref": "#/$defs/address"
    },
    "return_address": {
      "$ref": "#/$defs/address",
      "description": "Where returns go. Absent means the ship-from address, which is where most sellers want them; only fill this in when it genuinely differs."
    },
    "default_parcel": {
      "$ref": "#/$defs/parcel",
      "description": "DEPRECATED and read by nothing. It predates the box catalog and per-product dimensions, which is how a parcel is now decided. A single-product tenant is already served by that product's own Package Dimensions; duplicating it here only creates a second answer that can drift from the first. Kept so documents saved before this still validate."
    },
    "boxes": {
      "type": "array",
      "description": "The boxes this tenant actually packs into. Carrier packaging (USPS Flat Rate, UPS Express, FedEx Box) is NOT listed here -- it is fetched from the provider as parcel templates, because hand-copied carrier dimensions go stale the moment a size is retired. The packer works against the union of the two.",
      "items": {
        "$ref": "#/$defs/box"
      }
    },
    "enabled_services": {
      "type": "array",
      "description": "The carrier services this tenant OFFERS a buyer, in the same {carrier, service_token} vocabulary as domain/rate_policy.py. A page element may only NARROW this set, never widen it: a customer must not be able to ask for overnight when the tenant does not ship overnight (plans/SHIPPING_ELEMENT.md). Empty or absent means nothing is offered for selection, which is today's behaviour.",
      "items": {
        "type": "object",
        "additionalProperties": false,
        "required": [
          "service_token"
        ],
        "properties": {
          "service_token": {
            "type": "string",
            "minLength": 1
          },
          "carrier": {
            "type": "string"
          },
          "label": {
            "type": "string",
            "description": "What the BUYER reads, e.g. 'Ground (5-7 days)'. Absent falls back to the carrier's own name."
          },
          "transit_days_min": {
            "type": [
              "integer",
              "null"
            ],
            "minimum": 0
          },
          "transit_days_max": {
            "type": [
              "integer",
              "null"
            ],
            "minimum": 0
          },
          "source": {
            "type": "string",
            "enum": [
              "rate",
              "manual"
            ],
            "description": "Where this service came from. `rate` means it was adopted from a live carrier quote, so its code, carrier and transit estimate are the CARRIER's and the screen locks them -- a hand-edited service code is one that can never be quoted. `manual` means someone typed it, which stays editable and is shown as unverified."
          }
        }
      }
    },
    "zones": {
      "type": "array",
      "description": "What buyers pay, by destination. ORDERED: the FIRST zone matching the destination wins, and the LAST zone must be the catch-all ({country: \"*\"}) so 'everywhere else' always has an answer. A country may appear in at most one non-catch-all zone -- a duplicate is not an error the tenant sees, it is a silently dead second zone (plans/SHIPPING_ELEMENT.md).",
      "items": {
        "type": "object",
        "additionalProperties": false,
        "required": [
          "destinations",
          "rule"
        ],
        "properties": {
          "name": {
            "type": "string",
            "description": "The tenant's own label, e.g. 'United States'. Never shown to a buyer."
          },
          "destinations": {
            "type": "array",
            "minItems": 1,
            "description": "Where this zone applies. `regions` is deliberately ABSENT in V1 -- country is the V1 granularity -- and exists in the shape so subdivisions can be added later without a second field or a migration.",
            "items": {
              "type": "object",
              "additionalProperties": false,
              "required": [
                "country"
              ],
              "properties": {
                "country": {
                  "type": "string",
                  "minLength": 1,
                  "maxLength": 2,
                  "description": "ISO 3166-1 alpha-2, or \"*\" for the catch-all."
                },
                "regions": {
                  "type": "array",
                  "items": {
                    "type": "string"
                  },
                  "description": "NOT USED IN V1. State/province codes within the country when subdivision targeting arrives."
                }
              }
            }
          },
          "rule": {
            "type": "object",
            "additionalProperties": false,
            "required": [
              "type"
            ],
            "properties": {
              "type": {
                "type": "string",
                "enum": [
                  "free",
                  "flat",
                  "flat_rate_box",
                  "live"
                ]
              },
              "amount": {
                "type": "integer",
                "minimum": 0,
                "description": "Required when type is 'flat'. Cents the buyer pays."
              },
              "services": {
                "type": "array",
                "items": {
                  "type": "string"
                },
                "description": "Narrows enabled_services for this zone, e.g. no overnight to Canada. Never widens it."
              }
            }
          }
        }
      }
    },
    "rate_options": {
      "type": "object",
      "additionalProperties": false,
      "properties": {
        "default_service_level": {
          "type": "string"
        },
        "allowed_carriers": {
          "type": "array",
          "items": {
            "type": "string"
          }
        },
        "markup_amount": {
          "type": "integer",
          "minimum": 0
        },
        "free_shipping_threshold": {
          "type": "integer",
          "minimum": 0
        },
        "prefer": {
          "type": "string",
          "enum": [
            "cheapest",
            "fastest",
            "best_value"
          ]
        },
        "max_transit_days": {
          "type": [
            "integer",
            "null"
          ],
          "minimum": 1
        },
        "preferred_carrier": {
          "type": "string"
        },
        "preferred_carrier_tolerance": {
          "type": "integer",
          "minimum": 0
        },
        "max_auto_amount": {
          "type": [
            "integer",
            "null"
          ],
          "minimum": 0
        }
      }
    },
    "label_options": {
      "type": "object",
      "additionalProperties": false,
      "properties": {
        "format": {
          "type": "string",
          "enum": [
            "pdf",
            "png",
            "zpl"
          ],
          "default": "pdf"
        },
        "size": {
          "type": "string",
          "enum": [
            "4x6",
            "8.5x11"
          ],
          "default": "4x6"
        }
      }
    },
    "updated_at": {
      "type": "integer",
      "minimum": 0
    }
  },
  "$defs": {
    "box": {
      "type": "object",
      "additionalProperties": false,
      "required": [
        "name",
        "length",
        "width",
        "height"
      ],
      "properties": {
        "name": {
          "type": "string",
          "minLength": 1
        },
        "length": {
          "type": "number",
          "exclusiveMinimum": 0,
          "description": "INNER dimensions -- what fits inside, not the carton's outside."
        },
        "width": {
          "type": "number",
          "exclusiveMinimum": 0
        },
        "height": {
          "type": "number",
          "exclusiveMinimum": 0
        },
        "distance_unit": {
          "type": "string",
          "enum": [
            "in",
            "cm"
          ],
          "default": "in"
        },
        "empty_weight": {
          "type": "number",
          "minimum": 0,
          "description": "The box's own weight. A carrier bills the whole parcel, cardboard included."
        },
        "max_weight": {
          "type": [
            "number",
            "null"
          ],
          "exclusiveMinimum": 0,
          "description": "What the box may carry. Absent means no stated limit, which is the common case for a tenant's own carton -- refusing those would be worse than trusting them. A carrier refuses an over-weight parcel AFTER the label is paid for."
        },
        "mass_unit": {
          "type": "string",
          "enum": [
            "oz",
            "lb",
            "g",
            "kg"
          ],
          "default": "lb"
        },
        "kind": {
          "description": "Rigid carton or soft pack. A padded mailer's stated height is its FLAT measurement; stuffed, it bulges, so a soft pack checks its two largest dimensions strictly and treats thickness as capacity for items that squash. Pricing one as the other is why an 8x5x2 pouch used to climb to a carton. Default box -- rigid is the safe assumption.",
          "type": "string",
          "enum": [
            "box",
            "soft_pack"
          ],
          "default": "box"
        },
        "flat_rate": {
          "type": "object",
          "description": "What the tenant charges a buyer for this container, keyed by destination COUNTRY (ISO alpha-2). Country-keyed because flat rate is domestic by definition -- one number cannot serve two countries. The template describes the physical container; this describes what it costs the buyer in a place. Used by a zone whose rule type is 'flat_rate_box'; a shipping-configuration concern, never an Offer one.",
          "additionalProperties": {
            "type": "integer",
            "minimum": 0
          }
        },
        "template": {
          "description": "A carrier's own packaging identifier (USPS flat-rate envelopes and the like), passed straight through to the provider. Flat-rate packaging is frequently the cheapest option for a soft pack, and omitting it means those rates are never quoted at all. Absent means a custom parcel, which is what every box has been until now.",
          "type": [
            "string",
            "null"
          ]
        }
      }
    },
    "address": {
      "type": "object",
      "additionalProperties": false,
      "required": [
        "name",
        "street1",
        "city",
        "state",
        "postal_code",
        "country"
      ],
      "properties": {
        "name": {
          "type": "string"
        },
        "company": {
          "type": "string"
        },
        "street1": {
          "type": "string"
        },
        "street2": {
          "type": "string"
        },
        "city": {
          "type": "string"
        },
        "state": {
          "type": "string"
        },
        "postal_code": {
          "type": "string"
        },
        "country": {
          "type": "string",
          "minLength": 2,
          "maxLength": 2
        },
        "phone": {
          "type": "string"
        },
        "email": {
          "type": "string"
        },
        "residential": {
          "type": "boolean",
          "default": false
        }
      }
    },
    "parcel": {
      "type": "object",
      "additionalProperties": false,
      "required": [
        "length",
        "width",
        "height",
        "weight",
        "distance_unit",
        "mass_unit"
      ],
      "properties": {
        "length": {
          "type": "number",
          "exclusiveMinimum": 0
        },
        "width": {
          "type": "number",
          "exclusiveMinimum": 0
        },
        "height": {
          "type": "number",
          "exclusiveMinimum": 0
        },
        "weight": {
          "type": "number",
          "exclusiveMinimum": 0
        },
        "distance_unit": {
          "type": "string",
          "enum": [
            "in",
            "cm"
          ]
        },
        "mass_unit": {
          "type": "string",
          "enum": [
            "oz",
            "lb",
            "g",
            "kg"
          ]
        }
      }
    }
  },
  "description": "A tenant's shipping setup. Only the provider is required: a tenant must be able to save a key and TEST it before filling in addresses, which is the first thing anyone wants to do. Everything else is completeness for a particular action, not well-formedness of the document -- see label_readiness() in domain/shipping.py."
}
